{
  "body": {
    "action": "apply",
    "args": [
      "double",
      [
        1,
        2,
        3
      ]
    ],
    "target": "fn_fd20f137d331c42953ad164bd22cd1e6141cf310999818682832da4eb5fa8b66"
  },
  "constraints": {
    "budget_tokens": 1000,
    "capabilities": [],
    "deadline_ms": 5000
  },
  "from": "did:nova:ea9b49af638db86bff90080c8f1800535182ae30564132fb24276f06904e505e",
  "hash": "msg_a0574c9cc7d77722a66a9ba85b876aee086dcb0a9dc6dd6b3a12b78a4d56df8c",
  "in_reply_to": null,
  "kind": "request",
  "schema_version": "0.1.0",
  "signature": "ed25519:rb8X892iv5UY0c4E3HUnhXvMND6tmLRGUeEmEgC5N2lVcqTRbtG1CtW7wX4kyahipnKvaP3o5PjNvYWH3FKKBg==",
  "timestamp": "2026-06-04T18:00:00Z",
  "to": "did:nova:9b22c1d4e5f60718293a4b5c6d7e8f90a1b2c3d4e5f60718293a4b5c6d7e8f9b"
}
